username;date;retweets;favorites;text;geo;mentions;hashtags;id;permalink
realDonaldTrump;2012-04-17 12:30;197;95;"Our ally Canada is 'frustrated' by @BarackObama 's radical anti-gas policies http:// bit.ly/IRTyT6 BHO is forcing Canada to send gas to China.";;@BarackObama;;"192319079300870145";https://twitter.com/realDonaldTrump/status/192319079300870145
realDonaldTrump;2012-04-17 11:51;19;5;"Enjoyed watching @ericbolling $ @SarahPalinUSA 's @FoxNews special #PainatthePump over the weekend. (cont) http:// tl.gd/h13o32";;@ericbolling @SarahPalinUSA @FoxNews;#PainatthePump;"192309370841858048";https://twitter.com/realDonaldTrump/status/192309370841858048
realDonaldTrump;2012-04-17 10:51;95;10;"While @BarackObama watches, China is trying to have the yuan overtake our dollar as the international (cont) http:// tl.gd/h12vfv";;@BarackObama;;"192294299679989760";https://twitter.com/realDonaldTrump/status/192294299679989760
realDonaldTrump;2012-04-17 10:19;33;7;"He @MittRomney would do a great job on Saturday Night Live. @nbcsnl";;@MittRomney @nbcsnl;;"192286105448628224";https://twitter.com/realDonaldTrump/status/192286105448628224
realDonaldTrump;2012-04-17 10:15;49;10;"Paul Teutul Sr. is a fantastic guy. Although I fired him on #CelebApprentice , we will remain great friends. I love the bike he made for me.";;;#CelebApprentice;"192285256068505600";https://twitter.com/realDonaldTrump/status/192285256068505600
realDonaldTrump;2012-04-17 08:41;43;8;"I have captured the smell of success. Meet me and the new "Success" @Macys Herald Square April 18 5:30pm, first (cont) http:// tl.gd/h10nfo";;@Macys;;"192261494942081024";https://twitter.com/realDonaldTrump/status/192261494942081024