username;date;retweets;favorites;text;geo;mentions;hashtags;id;permalink
realDonaldTrump;2012-11-16 15:25;51;32;". @LaurenScruggs , who was badly injured by an airplane, was great on The Today Show!";;@LaurenScruggs;;"269566930954878976";https://twitter.com/realDonaldTrump/status/269566930954878976
realDonaldTrump;2012-11-16 15:15;428;115;"Now China is trying to take over a U.S. airbase http:// bit.ly/SoxUZf This is only the beginning. They only understand toughness!";;;;"269564335293087744";https://twitter.com/realDonaldTrump/status/269564335293087744
realDonaldTrump;2012-11-16 14:21;461;196;"“Much as it pays to emphasize the positive, there are times when the only choice is confrontation.” – The Art of the Deal";;;;"269550800068546560";https://twitter.com/realDonaldTrump/status/269550800068546560
realDonaldTrump;2012-11-16 13:51;237;62;"With the run on our dollar about to take place, commodity prices will rise. Gold, silver, & timber will spike-- also, certain real estate.";;;;"269543171497799680";https://twitter.com/realDonaldTrump/status/269543171497799680
realDonaldTrump;2012-11-16 13:36;186;44;"Fiscal cliff negotiations have officially begun between the President and Congress---Washington must come together and make a deal.";;;;"269539477947559936";https://twitter.com/realDonaldTrump/status/269539477947559936
realDonaldTrump;2012-11-16 13:20;37;17;"“Trump could be great friend if ‘Second Amendment’ enthusiasm is real” http:// bit.ly/WbxJBG via @SFLuxe";;@SFLuxe;;"269535418435903488";https://twitter.com/realDonaldTrump/status/269535418435903488
realDonaldTrump;2012-11-16 11:54;173;66;"Congratulations to @Mets @RADickey43 on becoming the first knuckleball pitcher to ever win the CY Young award!";;@Mets @RADickey43;;"269513890197561344";https://twitter.com/realDonaldTrump/status/269513890197561344
realDonaldTrump;2012-11-16 11:33;209;113;""I have an open door policy for my employees. I'm accessible because I like to know what's going on." -- The Midas Touch";;;;"269508616879501312";https://twitter.com/realDonaldTrump/status/269508616879501312
realDonaldTrump;2012-11-16 11:02;3;0;"@LaurenScruggs , who was badly injured by an airplane, was great on The Today Show!";;@LaurenScruggs;;"269500806045257728";https://twitter.com/realDonaldTrump/status/269500806045257728