username;date;retweets;favorites;text;geo;mentions;hashtags;id;permalink
realDonaldTrump;2012-10-21 16:35;132;51;"Don Butler and executives are doing a great job at @Cadillac --- the cars are fantastic.";;@Cadillac;;"260147412440604673";https://twitter.com/realDonaldTrump/status/260147412440604673
realDonaldTrump;2012-10-21 11:38;177;54;"The biggest problem with A-Rod is he is bad for the chemistry of the Yankees--- he must go.";;;;"260072531996856320";https://twitter.com/realDonaldTrump/status/260072531996856320
realDonaldTrump;2012-10-21 08:45;647;158;"Fort Hood shooting should be declared a terror attack. Respect the wounded and dead.";;;;"260029154127392768";https://twitter.com/realDonaldTrump/status/260029154127392768
realDonaldTrump;2012-10-20 18:25;167;39;"Good luck to Derek on his operation. I know it will be a success--- he is a great champion.";;;;"259812692792057857";https://twitter.com/realDonaldTrump/status/259812692792057857
realDonaldTrump;2012-10-20 18:24;127;26;"Derek must move back into one of my buildings immediately. It will be lucky for him like in past.";;;;"259812415385006080";https://twitter.com/realDonaldTrump/status/259812415385006080
realDonaldTrump;2012-10-20 18:24;771;400;"Derek Jeter broke ankle one day after he sold his apartment in Trump World Tower.";;;;"259812289509732352";https://twitter.com/realDonaldTrump/status/259812289509732352