username;date;retweets;favorites;text;geo;mentions;hashtags;id;permalink
realDonaldTrump;2012-03-09 13:49;40;5;"The Celebrity Apprentice, Sunday night at 9 PM on NBC. Another great episode! http:// bit.ly/6lyMkt";;;;"178221045080264704";https://twitter.com/realDonaldTrump/status/178221045080264704
realDonaldTrump;2012-03-09 10:19;22;8;"I'll be on @foxandfriends Monday at 7:30 AM, don't miss it.";;@foxandfriends;;"178168023574781952";https://twitter.com/realDonaldTrump/status/178168023574781952
realDonaldTrump;2012-03-09 07:56;237;17;"Coincidence? More than half of @BarackObama 's 47 biggest fundraisers have been given administration jobs. http:// wapo.st/woyDuw";;@BarackObama;;"178132094151696385";https://twitter.com/realDonaldTrump/status/178132094151696385
realDonaldTrump;2012-03-09 07:11;131;15;"The only candidate who can get 1145 delegates is @MittRomney . The primary is over.";;@MittRomney;;"178120715575369728";https://twitter.com/realDonaldTrump/status/178120715575369728
realDonaldTrump;2012-03-09 06:59;347;28;"BarackObama set a record deficit last February - $229 billion while borrowing 42 cents of every dollar it spent. @BarackObama is reckless.";;@BarackObama;;"178117802559934464";https://twitter.com/realDonaldTrump/status/178117802559934464