username;date;retweets;favorites;text;geo;mentions;hashtags;id;permalink
realDonaldTrump;2013-06-18 13:42;1427;716;"Young entrepreneurs – never back down. Take the hits and get up. That’s what makes a winner.";;;;"347076807780081664";https://twitter.com/realDonaldTrump/status/347076807780081664
realDonaldTrump;2013-06-18 11:13;971;488;"Keep testing your limits. Never become complacent. Always think big!";;;;"347039396379369472";https://twitter.com/realDonaldTrump/status/347039396379369472
realDonaldTrump;2013-06-18 08:30;4698;5268;"All I can say is that if I were President, Snowden would have already been returned to the U.S. (by their fastest jet) and with an apology!";;;;"346998236776640513";https://twitter.com/realDonaldTrump/status/346998236776640513
realDonaldTrump;2013-06-18 08:22;61;32;"Snowden is doing great damage to our relations with other countries and U.S.prestige. China is laughing at us as he continues illegal action";;;;"346996400963338240";https://twitter.com/realDonaldTrump/status/346996400963338240
realDonaldTrump;2013-06-18 08:13;95;37;"Snowden is sitting in China and taunting the U.S. He is mocking us as a Country. Great time to place a tax on China trade if not turned over";;;;"346993964483743746";https://twitter.com/realDonaldTrump/status/346993964483743746
realDonaldTrump;2013-06-18 04:51;52;59;"" @peaceloveandmeg : but when you're in a beauty contest ran by @realDonaldTrump , all the contestants are republican." Bad grammar (run).";;@peaceloveandmeg @realDonaldTrump;;"346943233277956096";https://twitter.com/realDonaldTrump/status/346943233277956096
realDonaldTrump;2013-06-17 20:31;18;20;"" @marzanoj : @realDonaldTrump people think of u as a real estate king. Rightly so, however, u r the marketing king as well." Thank you.";;@marzanoj @realDonaldTrump;;"346817411204395008";https://twitter.com/realDonaldTrump/status/346817411204395008
realDonaldTrump;2013-06-17 19:13;187;142;"Like it or not, haters and losers, everybody is talking about Miss U.S.A. and Miss Utah. By the way she is a fine young woman-unfair to her.";;;;"346797664240820224";https://twitter.com/realDonaldTrump/status/346797664240820224