username;date;retweets;favorites;text;geo;mentions;hashtags;id;permalink
realDonaldTrump;2014-02-04 14:48;291;239;""Realize that an entrepreneur's most important gift to the world is jobs, security, and well-being for others." - Midas Touch";;;;"430820071401725952";https://twitter.com/realDonaldTrump/status/430820071401725952
realDonaldTrump;2014-02-04 14:35;336;304;"Congress should be worried about American workers not people who came into our country by breaking our laws.";;;;"430816859391131648";https://twitter.com/realDonaldTrump/status/430816859391131648
realDonaldTrump;2014-02-04 14:19;258;118;"CBO estimates over 2.3M jobs will be lost due to ObamaCare http:// cnb.cx/MrErFZ Elections have consequences.";;;;"430812893538295809";https://twitter.com/realDonaldTrump/status/430812893538295809
realDonaldTrump;2014-02-04 12:01;249;119;"Congrats to Pres.Obama and Dems. CBO has TRIPLED its estimate of working hours lost due to ObamaCare http:// cnb.cx/MrErFZ Job Killer";;;;"430778077757468673";https://twitter.com/realDonaldTrump/status/430778077757468673
realDonaldTrump;2014-02-04 11:46;4;3;"@WineEnthusiast ’s highest rated wine in VA, @trumpwinery uses gentle techniques to produce quality wines http:// bit.ly/mWxEft";;@WineEnthusiast @trumpwinery;;"430774271560790016";https://twitter.com/realDonaldTrump/status/430774271560790016
realDonaldTrump;2014-02-04 11:38;49;54;"In 2016, the Old Post Office will be fully transformed into an iconic destination, Trump Int'l Washington DC http:// bit.ly/MrCrNN";;;;"430772360526823424";https://twitter.com/realDonaldTrump/status/430772360526823424
realDonaldTrump;2014-02-04 11:25;242;184;""Experience, knowledge, and prescience are a formidable combination of powers. Do not underestimate them." - Think Like a Champion";;;;"430769185237368832";https://twitter.com/realDonaldTrump/status/430769185237368832
realDonaldTrump;2014-02-04 10:28;649;402;"Our greatest weakness lies in giving up. The most certain way to succeed is always to try just one more time. --Thomas A. Edison";;;;"430754695192133634";https://twitter.com/realDonaldTrump/status/430754695192133634
realDonaldTrump;2014-02-04 08:23;36;29;"Wind energy is a complete economic disaster…. http:// on.wsj.com/1nIaz6D @AlexSalmond @AberdeenCC @David_Cameron @Aberdeenshire @ScotParl";;@AlexSalmond @AberdeenCC @David_Cameron @Aberdeenshire @ScotParl;;"430723385488723968";https://twitter.com/realDonaldTrump/status/430723385488723968