username;date;retweets;favorites;text;geo;mentions;hashtags;id;permalink
realDonaldTrump;2014-02-15 13:51;16;33;"" @enviroclean519 @TrumpChicago my wife and I stayed there for our anniversary.Beautiful place,amazed that all the staff remembered our name"";;@enviroclean519 @TrumpChicago;;"434792134219399168";https://twitter.com/realDonaldTrump/status/434792134219399168
realDonaldTrump;2014-02-15 13:50;25;25;"" @AdamEdinburg : @realDonaldTrump was watching home alone 2 with my son and you look the exact same! Can I get a RT??"";;@AdamEdinburg @realDonaldTrump;;"434791811782279168";https://twitter.com/realDonaldTrump/status/434791811782279168
realDonaldTrump;2014-02-15 13:48;50;34;"@LodgeatDoonbeg One of the great places on the planet, and will only get better now that I own it and will be investing large sums in it!";;@LodgeatDoonbeg;;"434791404188217344";https://twitter.com/realDonaldTrump/status/434791404188217344
realDonaldTrump;2014-02-15 04:35;54;87;"The brand new Blue Monster Golf Course at Trump National Doral is doing fantastic business. Also, the new driving range is open at night!";;;;"434652087470022656";https://twitter.com/realDonaldTrump/status/434652087470022656
realDonaldTrump;2014-02-15 01:55;54;97;"" @YoungSinatra : Donald trump is still my favorite Mac Miller track" Mac has certainly done well with me! How many hits now on Twitter?";;@YoungSinatra;;"434611881312268288";https://twitter.com/realDonaldTrump/status/434611881312268288
realDonaldTrump;2014-02-15 01:48;183;147;"" @MarkAdamsBball : "Without passion you don't have energy, without energy you have nothing."- Donald Trump #Passion "";;@MarkAdamsBball;#Passion;"434610206304378880";https://twitter.com/realDonaldTrump/status/434610206304378880
realDonaldTrump;2014-02-14 21:34;83;123;"A dishonest slob of a reporter, who doesn't understand my sarcasm when talking about him or his wife, wrote a foolish & boring Trump "hit"";;;;"434546124578648064";https://twitter.com/realDonaldTrump/status/434546124578648064
realDonaldTrump;2014-02-14 20:53;72;89;"" @DrewMadeOFF : RT @realDonaldTrump : "I never did a day's work in my #life . It was all #fun ." -- Thomas A. Edison"";;@DrewMadeOFF @realDonaldTrump;#life #fun;"434535926325600256";https://twitter.com/realDonaldTrump/status/434535926325600256