username;date;retweets;favorites;text;geo;mentions;hashtags;id;permalink
realDonaldTrump;2014-10-26 16:02;116;162;"" @pellscuse11 : @realDonaldTrump Did Hillary really say Businesses don't create jobs?! #Trump2016 "";Manhattan, NY;@pellscuse11 @realDonaldTrump;#Trump2016;"526494121671012352";https://twitter.com/realDonaldTrump/status/526494121671012352
realDonaldTrump;2014-10-26 15:37;288;389;"There are just so many penalties and such long commercials in these NFL games that they are no longer worth watching. Soft hitting & boring!";;;;"526487750137368577";https://twitter.com/realDonaldTrump/status/526487750137368577
realDonaldTrump;2014-10-26 06:55;87;182;"I would absolutely consider investing in Atlantic City again, great and hard working people, but much would have to change-taxes, regs., etc";;;;"526356367851130880";https://twitter.com/realDonaldTrump/status/526356367851130880
realDonaldTrump;2014-10-26 06:49;54;180;"Yes, I won the right to have my name taken off Trump Plaza in A.C. because it was not operated up to a very high standard and NO involvement";;;;"526354895985971200";https://twitter.com/realDonaldTrump/status/526354895985971200
realDonaldTrump;2014-10-26 06:43;63;131;"I made a fortune in Atlantic City, got out years ago (great timing), and havn't been back in many years. I have NOTHING to do with A.C.";;;;"526353443582402560";https://twitter.com/realDonaldTrump/status/526353443582402560
realDonaldTrump;2014-10-26 05:20;246;350;"With all that is happening with Ebola, including the doctor who so easily came back to New York, Obama still refuses to stop the flights!";;;;"526332546314174464";https://twitter.com/realDonaldTrump/status/526332546314174464
realDonaldTrump;2014-10-25 19:13;43;106;"" @mickeybeaupre : @realDonaldTrump I wish you would run For President Mr Trump we need you God Bless you."";;@mickeybeaupre @realDonaldTrump;;"526179807848329216";https://twitter.com/realDonaldTrump/status/526179807848329216
realDonaldTrump;2014-10-25 18:04;57;144;"" @Gam : BarackObama as one of your employers.. Are you really just turning your back on Isreal?? Trump for #President I'm rdy 4 change."";;@Gam;#President;"526162421187371008";https://twitter.com/realDonaldTrump/status/526162421187371008