username;date;retweets;favorites;text;geo;mentions;hashtags;id;permalink
realDonaldTrump;2015-02-24 13:11;41;53;"Trump International Golf Links and Hotel, Ireland, is located on the Atlantic Ocean in County Clare. Spectacular! http://www. trump.com/Hotel_Collecti on/Trump_Ireland/Trump_Ireland.asp …";;;;"570315063627808768";https://twitter.com/realDonaldTrump/status/570315063627808768
realDonaldTrump;2015-02-24 12:39;26;28;"Trump National Golf Club Los Angeles is situated on the Palos Verdes Peninsula overlooking the Pacific Ocean... http://www. trump.com/Golf_Clubs/Los _Angeles/Los_Angeles.asp …";;;;"570307168248987648";https://twitter.com/realDonaldTrump/status/570307168248987648
realDonaldTrump;2015-02-24 09:26;172;257;"The evening news broadcasts must stop talking about weather—boring and too many other topics.";;;;"570258558119497731";https://twitter.com/realDonaldTrump/status/570258558119497731
realDonaldTrump;2015-02-24 09:25;62;168;"I could fix tv talk shows that are doing poorly—there is tremendous talent out there waiting to be tapped—and nobody sees it!";;;;"570258104434233344";https://twitter.com/realDonaldTrump/status/570258104434233344
realDonaldTrump;2015-02-24 08:33;118;183;"Put the glamour, beauty & mystery back in the Oscars and the ratings will zoom. Also, & most importantly, the Oscars need credibility.";;;;"570245154818408449";https://twitter.com/realDonaldTrump/status/570245154818408449
realDonaldTrump;2015-02-24 08:26;154;263;"I told everybody the Oscars were no good—Nielsen ratings confirmed, one of the lowest ratings in history.";;;;"570243325552414720";https://twitter.com/realDonaldTrump/status/570243325552414720
realDonaldTrump;2015-02-24 08:09;208;351;"The @HuffingtonPost is a total joke & laughing stock of journalism, as is gross Arianna Huffington. They don’t report the facts!";;@HuffingtonPost;;"570238975157387264";https://twitter.com/realDonaldTrump/status/570238975157387264
realDonaldTrump;2015-02-24 07:54;2321;1249;"I have a lawsuit in Mexico’s corrupt court system that I won but so far can’t collect. Don’t do business with Mexico!";;;;"570235239848681472";https://twitter.com/realDonaldTrump/status/570235239848681472
realDonaldTrump;2015-02-24 07:53;1184;636;"The Oscars were a great night for Mexico & why not—they are ripping off the US more than almost any other nation.";;;;"570235124178161665";https://twitter.com/realDonaldTrump/status/570235124178161665