username;date;retweets;favorites;text;geo;mentions;hashtags;id;permalink
realDonaldTrump;2015-06-26 14:11;450;671;"Letter to @Univision - Re: @TrumpDoral https:// instagram.com/p/4Z8AaCGhUL/";;@Univision @TrumpDoral;;"614526331737411585";https://twitter.com/realDonaldTrump/status/614526331737411585
realDonaldTrump;2015-06-26 10:38;787;1704;"If I win the presidency, my judicial appointments will do the right thing unlike Bush's appointee John Roberts on ObamaCare.";;;;"614472830969880576";https://twitter.com/realDonaldTrump/status/614472830969880576
realDonaldTrump;2015-06-26 09:13;772;1031;". @Univision cares far more about Mexico than it does about the U.S. Are they controlled by the Mexican government?";;@Univision;;"614451323568824320";https://twitter.com/realDonaldTrump/status/614451323568824320
realDonaldTrump;2015-06-26 08:07;718;1191;"Anyone who wants strong borders and good trade deals for the US should boycott @Univision .";;@Univision;;"614434874179616768";https://twitter.com/realDonaldTrump/status/614434874179616768
realDonaldTrump;2015-06-26 08:06;808;1068;"Once again the Bush appointed Supreme Court Justice John Roberts has let us down. Jeb pushed him hard! Remember!";;;;"614434531861512193";https://twitter.com/realDonaldTrump/status/614434531861512193