username;date;retweets;favorites;text;geo;mentions;hashtags;id;permalink
realDonaldTrump;2016-04-29 12:28;12411;32866;"We are now at 1001 delegates. We will win on the first ballot and are not wasting time and effort on other ballots because system is rigged!";;;;"726115856053211136";https://twitter.com/realDonaldTrump/status/726115856053211136
realDonaldTrump;2016-04-29 10:04;7746;20143;"Thank you Indiana! #Trump2016 pic.twitter.com/WAuI0nRNzX";;;#Trump2016;"726079789182808065";https://twitter.com/realDonaldTrump/status/726079789182808065
realDonaldTrump;2016-04-29 07:46;10209;25923;"Crooked Hillary Clinton, perhaps the most dishonest person to have ever run for the presidency, is also one of the all time great enablers!";;;;"726045073775828992";https://twitter.com/realDonaldTrump/status/726045073775828992
realDonaldTrump;2016-04-29 05:22;5774;18887;"Wow, the ridiculous deal made between Lyin'Ted Cruz and 1 for 42 John Kasich has just blown up. What a dumb deal - dead on arrival!";;;;"726008645473824768";https://twitter.com/realDonaldTrump/status/726008645473824768
realDonaldTrump;2016-04-28 22:24;10134;30926;"Thank you Costa Mesa, California! 31,000 people tonight with thousands turned away. I will be back! #Trump2016 pic.twitter.com/4P0tzvZn0e";California, USA;;#Trump2016;"725903475133947904";https://twitter.com/realDonaldTrump/status/725903475133947904
realDonaldTrump;2016-04-28 22:08;4274;11830;"New York Yankees President, Randy Levine: 'End of the Republican Party' If Donald Trump Not Nominated. http://www. newsmax.com/Newsmax-Tv/ran dy-levine-new-york-yankees-end-republican/2016/04/28/id/726336/ …";;;;"725899554273423360";https://twitter.com/realDonaldTrump/status/725899554273423360
realDonaldTrump;2016-04-28 18:40;3914;13599;"I will be interviewed on @foxandfriends with the legendary Coach Bobby Knight- tomorrow morning. Enjoy! #INDPrimary pic.twitter.com/c9WVhfyMzs";;@foxandfriends;#INDPrimary;"725847301172776960";https://twitter.com/realDonaldTrump/status/725847301172776960