username;date;retweets;favorites;text;geo;mentions;hashtags;id;permalink
realDonaldTrump;2016-09-29 16:17;17180;31744;"While Hillary profits off the rigged system, I am fighting for you! Remember the simple phrase: #FollowTheMoney https://www. facebook.com/DonaldTrump/vi deos/10157784190830725/ … pic.twitter.com/rJXAzsaIwI";United States;;#FollowTheMoney;"781619038699094016";https://twitter.com/realDonaldTrump/status/781619038699094016
realDonaldTrump;2016-09-29 15:34;6518;17778;"Thank you for joining me this afternoon, New Hampshire! Will be back soon. #FollowTheMoney Speech transcript: https://www. facebook.com/DonaldTrump/po sts/10157791494485725:0 … pic.twitter.com/5hNrpkXEJS";;;#FollowTheMoney;"781608228710785024";https://twitter.com/realDonaldTrump/status/781608228710785024
realDonaldTrump;2016-09-29 13:16;7127;17020;"Join me in Manheim, Pennsylvania on Saturday at 7pm! #TrumpRally Tickets: https://www. donaldjtrump.com/schedule/regis ter/manheim-pa/ … pic.twitter.com/LNWQZ9yUJy";;;#TrumpRally;"781573427417128960";https://twitter.com/realDonaldTrump/status/781573427417128960
realDonaldTrump;2016-09-29 12:05;11313;39945;"My condolences to those involved in today's horrible accident in NJ and my deepest gratitude to all of the amazing first responders.";Queens, NY;;;"781555624446418944";https://twitter.com/realDonaldTrump/status/781555624446418944
realDonaldTrump;2016-09-28 21:42;7212;17534;"Will be in Novi, Michigan this Friday at 5:00pm. Join the MOVEMENT! Tickets available at: https://www. donaldjtrump.com/schedule/regis ter/novi-mi/ … #AmericaFirst #TrumpTrain pic.twitter.com/4V2bDNXF4n";;;#AmericaFirst #TrumpTrain;"781338220609073152";https://twitter.com/realDonaldTrump/status/781338220609073152
realDonaldTrump;2016-09-28 21:23;6592;17207;"Join me in Bedford, New Hampshire- tomorrow at 3:00pm. Can't wait to see everyone! #AmericaFirst #MAGA https://www. donaldjtrump.com/schedule/regis ter/bedford-nh/ … pic.twitter.com/zBtYfuqMmK";;;#AmericaFirst #MAGA;"781333457477758976";https://twitter.com/realDonaldTrump/status/781333457477758976
realDonaldTrump;2016-09-28 20:51;6730;17587;"Thank you Waukesha, Wisconsin! Full transcript of my speech, #FollowTheMoney : http:// bit.ly/2cMpbnvFollowT heMoney … pic.twitter.com/WdKK6nJCZW";Waukesha County Airport (UES);;#FollowTheMoney;"781325613189754880";https://twitter.com/realDonaldTrump/status/781325613189754880
realDonaldTrump;2016-09-28 18:01;4301;15608;"Joining @oreillyfactor from Waukesha, Wisconsin - now, live! Enjoy!";Waukesha, WI;@oreillyfactor;;"781282739026735105";https://twitter.com/realDonaldTrump/status/781282739026735105