username;date;retweets;favorites;text;geo;mentions;hashtags;id;permalink
realDonaldTrump;2016-06-19 07:17;10403;28802;"" @bfraser747 : Watch out HillaryClinton Support @realDonaldTrump #MakeAmericaGreatAgain pic.twitter.com/UTYOLo7wGF "";;@bfraser747 @realDonaldTrump;#MakeAmericaGreatAgain;"744519497764184064";https://twitter.com/realDonaldTrump/status/744519497764184064
realDonaldTrump;2016-06-18 21:01;10420;26974;"Yesterday's failing @NYTimes fraudulently shows an empty room prior to my speech, when in fact, it was packed! pic.twitter.com/iFuf8MdTEH";United States;@NYTimes;;"744364393962569728";https://twitter.com/realDonaldTrump/status/744364393962569728
realDonaldTrump;2016-06-18 20:57;7639;25604;"How can the NY Times show an empty room hours before my speech even started when they knew it was going to be packed? So totally dishonest!";United States;;;"744363535635996672";https://twitter.com/realDonaldTrump/status/744363535635996672
realDonaldTrump;2016-06-18 20:24;4878;14054;"Donald Trump's Speech Is a Game Changer. #Trump2016 https://www. facebook.com/DonaldTrump/po sts/10157169523180725 … pic.twitter.com/dIK3IyrYGC";;;#Trump2016;"744355251365511169";https://twitter.com/realDonaldTrump/status/744355251365511169
realDonaldTrump;2016-06-18 19:28;3624;12829;"See you soon Arizona! #Trump2016 pic.twitter.com/W4z2eW5ay4";;;#Trump2016;"744341058109247488";https://twitter.com/realDonaldTrump/status/744341058109247488
realDonaldTrump;2016-06-18 19:10;5023;16055;"I love you Arizona! Thank you! #Trump2016 #AmericaFirst pic.twitter.com/QuTsSmeVdO";Phoenix, AZ;;#Trump2016 #AmericaFirst;"744336626411700227";https://twitter.com/realDonaldTrump/status/744336626411700227