username;date;retweets;favorites;text;geo;mentions;hashtags;id;permalink
realDonaldTrump;2016-09-16 15:01;10106;29398;"Great parade in The Villages- I love you all. We will #MAGA . Thank you for the incredible support-I will not forget! pic.twitter.com/5qTDijU3hn";;;#MAGA;"776888753499561984";https://twitter.com/realDonaldTrump/status/776888753499561984
realDonaldTrump;2016-09-16 11:58;10402;26859;"I am truly honored and grateful for receiving SO much support from our American heroes... http:// bit.ly/2csHFXf pic.twitter.com/JJQncd3zhf";District of Columbia, USA;;;"776842647294009344";https://twitter.com/realDonaldTrump/status/776842647294009344
realDonaldTrump;2016-09-16 07:23;6582;26540;"I am now going to the brand new Trump International, Hotel D.C. for a major statement.";;;;"776773380414537728";https://twitter.com/realDonaldTrump/status/776773380414537728
realDonaldTrump;2016-09-15 21:31;5832;18327;"Thank you for a great evening - Laconia, New Hampshire -- will be back soon! #AmericaFirst http://www. DonaldJTrump.com pic.twitter.com/QWbYm2lY7B";;;#AmericaFirst;"776624517087133696";https://twitter.com/realDonaldTrump/status/776624517087133696
realDonaldTrump;2016-09-15 20:43;4390;15348;"" @AK_TWEET : #TheDonald 's hair gets the #JimmyFallon treatment on #TheTonightShow #TrumpPence16 pic.twitter.com/0RRPbfIgXH " So true!";;@AK_TWEET;#TheDonald #JimmyFallon #TheTonightShow #TrumpPence16;"776612349079855104";https://twitter.com/realDonaldTrump/status/776612349079855104
realDonaldTrump;2016-09-15 20:37;2506;10431;"" @jimmyfallon : Tonight: @realDonaldTrump , @normmacdonald , a performance by Kiiara,and your funniest #MyTeacherIsWeird tweets. #FallonTonight";;@jimmyfallon @realDonaldTrump @normmacdonald;#MyTeacherIsWeird #FallonTonight;"776611024996823040";https://twitter.com/realDonaldTrump/status/776611024996823040