username;date;retweets;favorites;text;geo;mentions;hashtags;id;permalink
realDonaldTrump;2016-05-29 17:02;5979;16190;"If dummy Bill Kristol actually does get a spoiler to run as an Independent, say good bye to the Supreme Court!";;;;"737056428452630528";https://twitter.com/realDonaldTrump/status/737056428452630528
realDonaldTrump;2016-05-29 16:58;6135;21052;"The Republican Party has to be smart & strong if it wants to win in November. Can't allow lightweights to set up a spoiler Indie candidate!";;;;"737055532960223233";https://twitter.com/realDonaldTrump/status/737055532960223233
realDonaldTrump;2016-05-29 16:53;5076;16297;"Bill Kristol has been wrong for 2yrs-an embarrassed loser, but if the GOP can't control their own, then they are not a party. Be tough, R's!";;;;"737054226833149952";https://twitter.com/realDonaldTrump/status/737054226833149952
realDonaldTrump;2016-05-29 15:43;6105;19908;"Good news is that my campaign has perhaps more cash than any campaign in the history of politics- b/c I stand 100% behind everything we do.";;;;"737036608915034112";https://twitter.com/realDonaldTrump/status/737036608915034112
realDonaldTrump;2016-05-29 10:45;4774;17910;"Heading to D.C. to see and hear ROLLING THUNDER. Amazing people that LOVE OUR COUNTRY. Great spirit!";;;;"736961734167146496";https://twitter.com/realDonaldTrump/status/736961734167146496
realDonaldTrump;2016-05-29 05:04;14972;40456;"Honor Memorial Day by thinking of and respecting all of the great men and women that gave their lives for us and our country! We love them.";;;;"736875933999697920";https://twitter.com/realDonaldTrump/status/736875933999697920